{
  "mode": "reposition",
  "run_id": "gtm-20260518-194319-cv",
  "decisions_log": [
    "ICP synthesis: Dunford-chassis with 6-persona panel + adaptive refinement loop (min 2 / max 3 iters, blocker-based termination)",
    "Positioning: strategic forks resolved by panel debate + refinement loop",
    "Discovery: deep web search via LLM_CHAT_COMPLETE webSearch:true (real-time citations) + user-supplied corpus URL fetch",
    "Asset voice: dunford committed; halbert + ogilvy variants contributed via judge composition",
    "Bundle: deterministic INLINE merge (no LLM, no token limits)"
  ],
  "positioning": {
    "recommended_positioning": {
      "that": "solves the trust barrier first with transparent sourcing, taste-test validation, and risk-free trial, then delivers ongoing curation value by pre-vetting new makers so you stop wasting time researching and money gambling on disappointing bars",
      "unlike": "Dandelion and Marou (proven quality but limited rotation causing boredom and gifting repetition), Bar & Cocoa and Cocoa Runners (curator subscriptions that ask for commitment before trust is earned), and unknown craft bars at coffee shops (beautiful packaging requiring 10 minutes of Instagram research to validate quality claims)",
      "for": "32-48 year old craft chocolate buyers currently spending $40-60/month rotating between Dandelion, Marou, and Pump Street at Whole Foods and Blue Bottle caf\u00e9s in SF, Portland, Brooklyn, Seattle, and Austin",
      "who_struggles_with": "exhaustion from being the guinea pig on $18 bar experiments after Mast Brothers broke their trust in beautiful branding, spending 10 minutes researching each unfamiliar maker at the shelf, and defaulting to the same 2-3 proven brands because discovery has too much friction and disappointment risk",
      "our_product": "Cacao Vir",
      "is_a": "trust-first craft chocolate membership that sequences proof before curation"
    },
    "category_design": {
      "category_name": "Trust-First Craft Chocolate Membership",
      "frame_of_reference": "When buyers encounter Cacao Vir, they'll instinctively try to categorize us using three existing frames that shape their expectations and evaluation criteria: Frame 1 is 'craft bean-to-bar chocolate makers' (Dandelion, Marou, Pump Street, Mast Brothers historically) where competition is on terroir storytelling, maker credentials, origin transparency, and flavor profile excellence\u2014buyers evaluate product quality, sourcing ethics, and maker reputation. Frame 2 is 'chocolate discovery subscriptions' (Bar & Cocoa, Cocoa Runners) where competition is on curation expertise, taste profile matching, editorial voice, and convenience\u2014buyers evaluate selection quality, value-per-bar, and whether monthly picks consistently delight. Frame 3 is 'specialty coffee shop impulse discovery' (buying unknown bars at Blue Bottle, Sightglass, or wine bars based on placement and barista recommendation) where competition is on contextual appropriateness and packaging appeal\u2014buyers evaluate whether $18 feels justified by environment and whether branding signals quality. Each frame has limitations that create positioning opportunities for Cacao Vir. Frame 1 (craft chocolate makers) puts us in direct competition with brands that have 10-15 years of equity, factory tours, retail ubiquity, and customer loyalty\u2014extremely difficult to win as unknown pre-launch brand, and doesn't solve the ICP's core pain (discovery fatigue). We'd be asking 'trust us, we're also great' when buyer explicitly says 'I don't trust beautiful branding anymore.' Frame 2 (discovery subscriptions) asks for monthly commitment before trust is earned, which violates buyer psychology post-Mast Brothers\u2014Bar & Cocoa requires subscription to access curation, but our ICP won't subscribe to someone they don't trust yet. Frame 3 (coffee shop discovery) works for INITIAL introduction to established brands but fails for SYSTEMATIC ongoing discovery of new makers\u2014buyers return to same 2-3 familiar brands at Blue Bottle month after month because (a) coffee shops stock limited selection optimized for proven sellers not emerging makers, (b) coffee shop curation doesn't rotate frequently enough to facilitate continuous discovery, and (c) buyers won't gamble $18 on unfamiliar packaging even in trusted retail context after Mast Brothers experience. Coffee shop discovery succeeds at 'try Dandelion for first time' but fails at 'expand beyond Dandelion into 20 other quality makers.' Our chosen category\u2014Trust-First Craft Chocolate Membership\u2014reframes all three limitations by sequencing two distinct jobs-to-be-done that existing frames fail to sequence correctly. We solve the FIRST PURCHASE job (overcome trust barrier post-Mast Brothers) through proof-forward positioning: taste-test validation comparing directly to Dandelion, transparent sourcing documentation, maker credentials, and unconditional satisfaction guarantee that reverses the $18 risk. This job must be completed before buyer will engage with ongoing relationship. Then we solve the REPEAT PURCHASE job (eliminate discovery fatigue and research tax) through membership benefits: pre-vetted bars from quality makers buyer would never find independently, curated rotation that expands repertoire beyond the same 2-3 safe brands, and research elimination so they stop spending 10 minutes at shelf Googling every unfamiliar maker. Membership signals this is graduated relationship with earned trust, not transactional one-time purchase (Frame 1 problem) or blind commitment subscription (Frame 2 problem). The category advantages: (1) Differentiates from craft brands by solving discovery not just making chocolate\u2014we're not claiming 'we're better than Dandelion,' we're claiming 'we help you find makers AS GOOD AS Dandelion that you've never heard of.' (2) Differentiates from subscription boxes by earning trust before asking for commitment\u2014we don't say 'subscribe and we'll curate,' we say 'try one bar risk-free, validate quality yourself, THEN consider membership.' (3) Differentiates from coffee shop discovery by providing systematic ongoing discovery\u2014we solve 'rotation expansion beyond Blue Bottle's 4-6 stocked brands.' (4) Directly addresses documented buyer psychology: won't commit without proof, but desperately needs curation once trust is established\u2014existing frames force false choice between one or the other. (5) Creates space for sequenced offer architecture that converts skeptical buyers: first purchase is proof demonstration (single bar or 3-bar flight with guarantee), repeat purchase unlocks membership benefits (subscription, exclusive origins, early access). The category acknowledges that post-Mast-Brothers, craft chocolate has a trust crisis the industry isn't solving\u2014makers ask you to trust their claims, curators ask you to trust their selections, but nobody says 'don't trust us yet, prove it yourself first, then we'll deliver ongoing value.' We own that positioning space."
    },
    "strategic_forks": [
      {
        "option_b": {
          "positioning": "Higher commitment but compressed trust-building: 3-bar tasting flight at $39 featuring three distinct origins (Ecuador bright fruit, Madagascar earthy, Peru balanced) with side-by-side tasting guide comparing each to equivalent Dandelion bars. Same unconditional guarantee: if you don't prefer at least one of our bars to Dandelion, keep all three and we'll refund you. Flight format demonstrates curation expertise immediately (we've already filtered quality and showcased range) and increases odds that buyer finds one origin they love. Post-flight, subscription offer is natural next step: 'You found your favorite origin\u2014let us send more like it monthly.' Higher AOV means fewer transactions to breakeven.",
          "label": "Trust-First Tasting Flight: 3-bar curated flight at $39 with same guarantee",
          "tradeoff": "Higher friction at first purchase\u2014$39 commitment vs $18 feels steeper when trust hasn't been earned yet, particularly for ICP who 'don't want another $18 mistake' (now asking for $39 mistake). Decision paralysis on 'which three origins?' if buyer has to choose vs pre-curated. Guarantee exposure is 3x: if buyer dislikes all three bars (rare but possible given craft chocolate's polarizing flavor profiles), we've given away $39 not $18. But: faster path to subscription\u2014buyers who love the flight format are pre-qualified for subscription and convert at ~40-50% vs 25-30% for single-bar buyers. CAC payback: $39 at 70% margin = $27.30 gross profit, minus $6 guarantee reserve (assuming 12% claim rate, though flight format likely lowers claims to 8% because finding ONE liked bar out of three is easier) = ~$21 first-purchase contribution. At $50 CAC, breakeven is purchase 2-3. Model works if >25% of flight buyers subscribe at $49/month by month 3."
        },
        "fork_name": "First Purchase Offer: Trust-First Single Bar vs. Trust-First Tasting Flight",
        "recommendation": "a",
        "option_a": {
          "positioning": "Lowest commitment entry: try one exceptional single-origin bar at $18 with unconditional satisfaction guarantee\u2014if you don't taste the difference from Dandelion in the first bite, keep the bar and we'll refund you. Packaging includes tasting notes comparing directly to Dandelion's same-origin bar, maker credentials (competition wins, roaster background), and transparent sourcing story. After satisfaction, packaging offers subscription QR code: 'Loved it? Join monthly membership and we'll handle discovery for you.' Single-bar trial removes decision paralysis (no 'which three bars?' complexity) and minimizes financial risk.",
          "label": "Trust-First Single Bar: One $18 bar with unconditional satisfaction guarantee",